{
  "$schema": "http://json-schema.org/draft-07/schema#",
  "type": "object",
  "required": ["device", "device_class", "evidence", "claims", "gaps", "trace"],
  "additionalProperties": false,
  "properties": {
    "device": {"type": "string"},
    "device_class": {"enum": ["transducer", "source"]},
    "language": {"enum": ["zh", "en", "bi"]},
    "tonal": {"type": "object"},
    "engineering": {"type": "object"},
    "literary_zh": {"type": "string"},
    "literary_en": {"type": "string"},
    "evidence": {"type": "array", "items": {
      "type": "object", "required": ["source_id", "tier", "freshness"],
      "additionalProperties": false,
      "properties": {"source_id": {"type": "string"}, "source_lean": {"type": "string"},
        "tier": {"type": "integer", "minimum": 1, "maximum": 4}, "freshness": {"type": "string"},
        "url": {"type": "string"}, "snippet": {"type": "string"}}}},
    "claims": {"type": "array", "items": {
      "type": "object", "required": ["text", "provenance", "source_ids", "confidence"],
      "additionalProperties": false,
      "properties": {"text": {"type": "string"},
        "provenance": {"enum": ["measured", "consensus", "prior"]},
        "source_ids": {"type": "array", "items": {"type": "string"}},
        "confidence": {"type": "number", "minimum": 0, "maximum": 1},
        "attribute": {"type": "string", "pattern": "^[a-z][a-z0-9_]*$"}, "dissent": {"type": "string"}}}},
    "gaps": {"type": "array", "items": {"type": "string"}},
    "trace": {"type": "object", "required": ["skill_version", "loaded_source_ids", "environment_stability"],
      "additionalProperties": false,
      "properties": {"skill_version": {"type": "string"},
        "loaded_source_ids": {"type": "array", "items": {"type": "string"}},
        "environment_stability": {"enum": ["stable", "unstable"]}}}
  }
}
