{
  "device": "Example Warm IEM (fixture)",
  "device_class": "transducer",
  "language": "bi",
  "tonal": {
    "signature_zh": "暖声", "signature_en": "warm",
    "target": "harman_ie_2019", "rig": "iec711",
    "bands": {"sub_bass": 1, "mid_bass": 1, "lower_mids": 0, "center_mids": 0, "upper_mids": 0, "lower_treble": -1, "mid_treble": -1, "air": -1}
  },
  "evidence": [
    {"source_id": "crinacle", "source_lean": "measurement-anchored + subjective ranking", "tier": 1, "freshness": "2026-04", "snippet": "711-measured: ~+1 量感 bass shelf, relaxed treble vs Harman IE 2019"},
    {"source_id": "erji", "source_lean": "impression-led, warm lean", "tier": 3, "freshness": "2026-03", "snippet": "温暖耐听，声场中等偏上，结像清晰，解析中规中矩"},
    {"source_id": "specsheet", "source_lean": "manufacturer spec (prior)", "tier": 4, "freshness": "2026-01", "snippet": "single dynamic driver; successor tuning in the brand's warm line"},
    {"source_id": "asr_iem", "source_lean": "measurement-absolutist", "tier": 2, "freshness": "2026-02", "snippet": "THD < 0.5% at 94 dB SPL; no obvious driver breakup in the audible band"}
  ],
  "claims": [
    {"text": "Sub-bass slightly elevated (+1 量感) vs Harman IE 2019 on IEC711.", "provenance": "measured", "source_ids": ["crinacle"], "confidence": 0.9, "attribute": "sub_bass"},
    {"text": "Mid-bass slightly elevated (+1 量感); warm foundation.", "provenance": "measured", "source_ids": ["crinacle"], "confidence": 0.85, "attribute": "mid_bass"},
    {"text": "Lower-mids neutral (0 量感).", "provenance": "measured", "source_ids": ["crinacle"], "confidence": 0.85, "attribute": "lower_mids"},
    {"text": "Center-mids neutral (0 量感).", "provenance": "measured", "source_ids": ["crinacle"], "confidence": 0.85, "attribute": "center_mids"},
    {"text": "Upper-mids neutral (0 量感); vocals neither shouty nor recessed.", "provenance": "measured", "source_ids": ["crinacle"], "confidence": 0.8, "attribute": "upper_mids"},
    {"text": "Lower-treble slightly lacking (-1 量感); low sibilance risk.", "provenance": "measured", "source_ids": ["crinacle"], "confidence": 0.85, "attribute": "lower_treble"},
    {"text": "Mid-treble slightly lacking (-1 量感); relaxed detail edge.", "provenance": "measured", "source_ids": ["crinacle"], "confidence": 0.85, "attribute": "mid_treble"},
    {"text": "Air slightly lacking (-1 量感); modest top-end sparkle.", "provenance": "measured", "source_ids": ["crinacle"], "confidence": 0.8, "attribute": "air"},
    {"text": "Overall signature is warm (elevated bass + relaxed treble), measured on IEC711 vs Harman IE 2019.", "provenance": "measured", "source_ids": ["crinacle"], "confidence": 0.85},
    {"text": "Soundstage above average.", "provenance": "consensus", "source_ids": ["erji"], "confidence": 0.45, "attribute": "soundstage", "dissent": "one erji poster calls it merely average; tier-3 impression-led, warm-lean bias-corrected"},
    {"text": "Imaging is clear / well-placed.", "provenance": "consensus", "source_ids": ["erji"], "confidence": 0.5, "attribute": "imaging"},
    {"text": "Resolution is average for its tier.", "provenance": "consensus", "source_ids": ["erji"], "confidence": 0.45, "attribute": "resolution"},
    {"text": "Timbre is natural, helped by the relaxed treble.", "provenance": "consensus", "source_ids": ["erji"], "confidence": 0.4, "attribute": "timbre"},
    {"text": "Single dynamic driver; part of the brand's warm-tuned line (lineage prior).", "provenance": "prior", "source_ids": ["specsheet"], "confidence": 0.5},
    {"text": "Distortion is low (THD < 0.5% at 94 dB SPL); no obvious driver stress in the audible band.", "provenance": "measured", "source_ids": ["asr_iem"], "confidence": 0.8}
  ],
  "gaps": [
    "No CSD/decay (waterfall) data found.",
    "Technicalities rest on a single tier-3 impression-led source; soundstage rating is contested.",
    "No cross-measurer FR to bound unit/rig variance."
  ],
  "trace": {"skill_version": "0.2.0", "loaded_source_ids": ["crinacle", "erji", "specsheet", "asr_iem"], "environment_stability": "unstable"}
}
