{
  "device": "Quiet DAC", "device_class": "source", "language": "en",
  "evidence": [{"source_id": "asr", "source_lean": "measurement-absolutist", "tier": 1, "freshness": "2026-01"}],
  "claims": [
    {"text": "Engineering competence is transparent (SINAD 118).", "provenance": "measured", "source_ids": ["asr"], "confidence": 0.95},
    {"text": "The noise floor is inaudible even with sensitive IEMs.", "provenance": "consensus", "source_ids": ["asr"], "confidence": 0.7}
  ],
  "gaps": [],
  "trace": {"skill_version": "1.0.0", "loaded_source_ids": ["asr"], "environment_stability": "unstable"}
}
